Title,Source,Published,URL
"30-second bursts of exercise may help reduce panic attacks, study finds - The Washington Post",The Washington Post,2026-05-20T11:32:39Z,https://www.washingtonpost.com/wellness/2026/05/20/how-brief-bursts-intense-exercise-may-help-reduce-panic-attacks/
"Harry Styles’ Team Responds to Fan Complaints About Obstructed ‘Together, Together’ Tour Sightlines - Yahoo",Billboard,2026-05-20T11:30:01Z,http://www.billboard.com/music/music-news/harry-styles-together-together-tour-sightline-complaints-1236252425/
"‘Even better than tech.’ A scramble into this sector is coming, warns veteran wealth manager. - MarketWatch",MarketWatch,2026-05-20T11:01:00Z,https://www.marketwatch.com/story/even-better-than-tech-a-scramble-into-this-sector-is-coming-warns-veteran-wealth-manager-e6594815
More die of suspected Ebola as WHO warns that numbers will rise further - BBC,BBC News,2026-05-20T10:59:01Z,https://www.bbc.com/news/articles/cwy2g197dp8o
Google expands AI push at I/O with enterprise-focused Gemini upgrades and smarter search tools - Yahoo Finance,Advfn.com,2026-05-20T10:35:17Z,https://investorshub.advfn.com/market-news/article/28706/google-expands-ai-push-at-i-o-with-enterprise-focused-gemini-upgrades-and-smarter-search-tools
Stellantis CEO Antonio Filosa is about to unveil his plan to turn the company around as the automaker's stock lags - CNBC,CNBC,2026-05-20T10:30:01Z,https://www.cnbc.com/2026/05/20/stellantis-stock-stla-capital-markets-day-antonio-filosa.html
Five Games Are Available Today Across Multiple Tiers Of Xbox Game Pass (May 20) - Pure Xbox,Pure Xbox,2026-05-20T10:00:00Z,https://www.purexbox.com/news/2026/05/five-games-are-available-today-across-multiple-tiers-of-xbox-game-pass-may-20
Trump’s grip on the party threatens his grasp of Congress - Politico,Politico,2026-05-20T09:55:00Z,https://www.politico.com/news/2026/05/20/trump-revenge-midterms-00929255
Iran threatens to extend conflict ‘beyond the region’ if U.S. and Israel resume attacks - CNBC,CNBC,2026-05-20T09:14:06Z,https://www.cnbc.com/2026/05/20/iran-war-us-israel-middle-east.html
